{
  "$schema": "https://json-schema.org/draft/2020-12/schema",
  "$id": "https://beateros.dev/contracts/agent_session.schema.json",
  "title": "AgentSession",
  "description": "One goal-directed run. final.md section 12.1. Canonical required fields are mandated; implementations may add fields (additionalProperties is open on purpose so the reference Rust crate and future services can extend without breaking interop).",
  "type": "object",
  "required": [
    "session_id",
    "created_at",
    "created_by",
    "agent_id",
    "workspace_id",
    "goal",
    "constraints",
    "policy_profile",
    "initial_capability_ids",
    "budget",
    "model_policy",
    "memory_scope",
    "journal_root",
    "status"
  ],
  "properties": {
    "session_id": { "$ref": "common.schema.json#/$defs/Id" },
    "created_at": { "$ref": "common.schema.json#/$defs/Timestamp" },
    "created_by": { "$ref": "common.schema.json#/$defs/Id" },
    "agent_id": { "$ref": "common.schema.json#/$defs/Id" },
    "workspace_id": { "$ref": "common.schema.json#/$defs/Id" },
    "goal": { "type": "string", "minLength": 1 },
    "constraints": {
      "type": "array",
      "items": { "type": "string" },
      "description": "Human-authored guardrails on the run. May be empty but must be present."
    },
    "policy_profile": { "type": "string", "minLength": 1 },
    "initial_capability_ids": {
      "type": "array",
      "items": { "$ref": "common.schema.json#/$defs/Id" },
      "description": "Grants present at session start. Invariant: a session cannot execute actions without at least one capability grant, so an empty list means the session is inert until a grant is issued."
    },
    "budget": { "$ref": "common.schema.json#/$defs/Budget" },
    "model_policy": {
      "type": "object",
      "properties": {
        "allowed_routes": { "type": "array", "items": { "type": "string" } },
        "local_only": { "type": "boolean" },
        "max_data_class": { "$ref": "common.schema.json#/$defs/DataClass" }
      },
      "additionalProperties": true
    },
    "memory_scope": {
      "type": ["string", "null"],
      "description": "Named memory partition, or null for an ephemeral session with no persistent memory."
    },
    "journal_root": {
      "type": "string",
      "minLength": 1,
      "description": "Root reference of the append-only journal for this session."
    },
    "status": { "$ref": "common.schema.json#/$defs/SessionStatus" }
  },
  "additionalProperties": true
}
