{
  "session_id": "sess_01J8Z4",
  "created_at": "2026-07-03T18:00:00Z",
  "created_by": "human:jaden",
  "agent_id": "agent:coder-1",
  "workspace_id": "ws:beateros",
  "goal": "Fix the failing test in the parser and open a PR.",
  "constraints": [
    "Do not touch files outside crates/parser.",
    "Do not make network calls."
  ],
  "policy_profile": "default-restrictive",
  "initial_capability_ids": ["grant_repo_rw_01"],
  "budget": {
    "max_model_cents": 500,
    "max_tool_calls": 200,
    "max_wall_ms": 1800000
  },
  "model_policy": {
    "allowed_routes": ["local:code-small", "cloud:frontier"],
    "local_only": false,
    "max_data_class": "code"
  },
  "memory_scope": "ws:beateros:coder-1",
  "journal_root": "journal://sess_01J8Z4/root",
  "status": "running"
}
